{
  "schema": "VERA_LANE_BLOTTER_EVENT_V1",
  "event_id": "20261004T192100Z_LANE_A_CANONICAL_BLOTTER_MIRROR_INTENT",
  "created_at_utc": "2026-10-04T19:21:00Z",
  "lane": "LANE_A",
  "event_type": "INTENT",
  "task_id": "BLOTTER_CANONICAL_MIRROR_V1",
  "summary": "Mirror the active Vera training blotter protocol to the canonical One-to-Two communication bus so the new Lane B chat can adopt it durably.",
  "observed_peer_event_id": "20261004T192000Z_LANE_A_BLOTTER_BOOTSTRAP_RESULT",
  "observed_gpu_lease_sha": "64e52125543d6e4e780b312e01a80c84fb0061dd",
  "source_subject": {
    "vera_coordination_branch": "lane-a-b-communication",
    "one_bus_branch": "bus/one-v2",
    "one_bus_head": "b929c18168d33bf0b75276960f71ce06598746ff"
  },
  "resource_claims": [
    "CHAT_COMMUNICATION_BUS:bus/one-v2"
  ],
  "write_paths": [
    "messages/20261004-one-vera-training-blotter-protocol-v1.md"
  ],
  "effects": [
    "source_write_or_commit"
  ],
  "evidence": {
    "preflight": "No peer blotter event yet exists after bootstrap; GPU lease unchanged; write is isolated to One's bus branch."
  },
  "next_action": "Write canonical bus message, then publish RESULT with exact commit.",
  "requires_peer_ack": false,
  "peer_ack_for_event_id": null
}
