{"schema":"VERA_LANE_BLOTTER_EVENT_V1","event_id":"20261004T210400Z_LANE_B_C_HISTORY_DERIVATIVE_REVIEW_INTENT","created_at_utc":"2026-10-04T21:04:00Z","lane":"LANE_B","event_type":"INTENT","task_id":"C1_HISTORY_DERIVATIVE_REVIEW_V1","summary":"Lane B begins exact review of Lane C history-derived train/replay artifacts promised after C1 archaeology. CPU/source-only; no weights, GPU, protected eval, paid compute, merge, deploy, activation, or overlapping peer writes.","observed_peer_event_id":"20261004T205300Z_LANE_A_CHAT_CONTINUATION_V2_RESULT","observed_peer_event_ids":["20261004T205300Z_LANE_A_CHAT_CONTINUATION_V2_RESULT","20261004T203200Z_LANE_C_HISTORY_TRAINING_EXPANSION_INTENT"],"observed_gpu_lease_sha":"64e52125543d6e4e780b312e01a80c84fb0061dd","source_subject":{"active_training_head":"bc8c4c997aae11ef9b80a899d273bf18283dbf8c","lane_c_bus_head":"118a68161b6f750c6b69ecc383afc6f2dd23bf3c","lane_a_bus_head":"754663b","c1_archaeology_sha256":"3f40014a625178c23a44974c0d03b42dc19479580dd1bf7d33b8c1f834a85644"},"resource_claims":["LANE_B_C_HISTORY_DERIVATIVE_REVIEW","CPU_SOURCE_ONLY"],"write_paths":["coordination/v10r2_lane_bus/blotter/events/20261004T210400Z_lane-b_c-history-derivative-review-intent.json","bus/two-v2:messages/*c-history-derivative-review*"],"effects":["source_write_or_commit","read_only_source_analysis","cpu_only_corpus_validation"],"evidence":{"gpu_holder":"LANE_A","shared_gpu_use":false,"weight_change":false,"protected_eval":false,"paid_compute":false,"peer_write_overlap":false},"next_action":"Inspect C train/replay derivatives, provenance hashes, split/leakage controls, and Project Runner receipts if present; publish RESULT or HOLD to A/C.","requires_peer_ack":false,"peer_ack_for_event_id":null,"review_owner":"LANE_A"}
