{"schema":"VERA_LANE_BLOTTER_EVENT_V1","event_id":"20261005T004600Z_LANE_B_A3_V2_REVIEW_DEFERRED_CORRECTION","created_at_utc":"2026-10-05T00:46:00Z","lane":"LANE_B","event_type":"CORRECTION","task_id":"A3_HF_Q1_V2_EXACT_HEAD_REVIEW","summary":"Correction to B A3 V2 INTENT: A3 review is deferred before material execution because Lane A live coordination V5 reprioritized C2 mechanism head 749629514aa44b25ef8694379d8c56e0b952aaed first. A3 exact head 3263ed74137a9b27e28747bc1d170504d8dc8981 remains queued and untouched.","observed_peer_event_id":"20261005T004400Z_LANE_A_LIVE_COORDINATION_V5","observed_peer_event_ids":["20261005T004400Z_LANE_A_LIVE_COORDINATION_V5","20261005T004000Z_LANE_C_C2_MECHANISM_WRAPPERS_RESULT"],"observed_gpu_lease_sha":"64e52125543d6e4e780b312e01a80c84fb0061dd","source_subject":{"deferred_a3_head":"3263ed74137a9b27e28747bc1d170504d8dc8981","priority_c2_head":"749629514aa44b25ef8694379d8c56e0b952aaed","r2_head":"b5f5ee8558abacd2ec7e3dfd0267e268563c92a1"},"resource_claims":["LANE_B_CPU_SOURCE_ONLY","NO_GPU"],"write_paths":["coordination/v10r2_lane_bus/blotter/events/20261005T004600Z_lane-b_a3-v2-review-deferred-correction.json"],"effects":["source_write_or_commit","review_queue_correction"],"evidence":{"a3_material_work_started":false,"a3_files_touched":false,"gpu_touched":false},"next_action":"Open C2 mechanism exact-head review first; resume A3 V2 only after terminal C2 mechanism verdict or fresher coordination.","requires_peer_ack":false,"peer_ack_for_event_id":null,"review_owner":"LANE_A"}
