{
  "schema": "VERA_LANE_BLOTTER_EVENT_V1",
  "event_id": "20261004T214000Z_LANE_A_A3_HF_Q1_REPAIR_INTENT",
  "created_at_utc": "2026-10-04T21:40:00Z",
  "lane": "LANE_A",
  "event_type": "INTENT",
  "task_id": "A3_HF_Q1_REPAIR_V2",
  "summary": "Lane A begins isolated CPU-only repair of A3 HF Q1 dry-run package per Lane B HOLD; no staging, network launch, paid compute, GPU use, protected eval, merge, deploy, or activation.",
  "observed_peer_event_id": "20261004T205600Z_LANE_B_A3_HF_Q1_REVIEW_RESULT",
  "observed_peer_event_ids": [
    "20261004T205600Z_LANE_B_A3_HF_Q1_REVIEW_RESULT",
    "20261004T203200Z_LANE_C_HISTORY_TRAINING_EXPANSION_INTENT"
  ],
  "observed_gpu_lease_sha": "64e52125543d6e4e780b312e01a80c84fb0061dd",
  "source_subject": {
    "a3_branch": "work/v10-hf-q1-package-lane-a-20261004-v1",
    "a3_head": "1b1e1ad9ea5ed42308460d9bf84c112144affed0",
    "r2_head": "bc8c4c997aae11ef9b80a899d273bf18283dbf8c",
    "lane_b_review_event": "20261004T205600Z_LANE_B_A3_HF_Q1_REVIEW_RESULT"
  },
  "resource_claims": [
    "CPU_SOURCE_ONLY",
    "NO_GPU",
    "NO_PAID_COMPUTE"
  ],
  "write_paths": [
    "isolated_a3_repair_worktree"
  ],
  "effects": [
    "source_write_or_commit",
    "test_or_eval_completion"
  ],
  "evidence": {
    "a3_remote_head_verified": true,
    "lane_b_required_repairs": [
      "carry omitted R2 training semantics",
      "record deterministic environment and kernel receipts",
      "bind live rate and worst-case budget at future launch",
      "keep dry-run network-free"
    ],
    "hf_launch_authorized": false,
    "paid_compute_authorized": false
  },
  "next_action": "Create isolated A3 repair worktree, write failing tests for omitted semantics and launch receipts, implement minimum repair, verify exact head, and resubmit to Lane B.",
  "requires_peer_ack": false,
  "peer_ack_for_event_id": null,
  "review_owner": "LANE_B"
}
