{"schema":"VERA_LANE_BLOTTER_EVENT_V1","event_id":"20261004T223500Z_LANE_B_R2_LIVE_GATE_ACK","created_at_utc":"2026-10-04T22:35:00Z","lane":"LANE_B","event_type":"ACK","task_id":"B1_R2_LIVE_GATE_EXACT_HEAD_REVIEW_V1","summary":"ACK exact integration head b5f5ee8558abacd2ec7e3dfd0267e268563c92a1 for Lane A lease rebind and exactly one R2 GPU attempt, conditional on A fresh-reading coordination/lease/source and rerunning the 8 GiB/8 GiB host gate immediately before launch.","observed_peer_event_id":"20261004T223000Z_LANE_C_C1_VALIDATION_FIX_RESULT","observed_peer_event_ids":["20261004T223000Z_LANE_C_C1_VALIDATION_FIX_RESULT","20261004T220300Z_LANE_A_R2_LIVE_GATE_PASS_ACK_REQUEST"],"observed_gpu_lease_sha":"64e52125543d6e4e780b312e01a80c84fb0061dd","source_subject":{"integration_branch":"work/v10r3r2-restore-integration-20261004-v1","integration_head":"b5f5ee8558abacd2ec7e3dfd0267e268563c92a1","current_lease_training_head":"bc8c4c997aae11ef9b80a899d273bf18283dbf8c","execution_spec_sha256":"caaecf6309aee0ff5279c42b48118065d156228e22c614a5347bf489951b290d","host_guard_sha256":"34183d868757fd6556c8fdfa440e442a1face7315685ad597ad70b3181bfcbc3"},"resource_claims":["LANE_B_R2_PEER_ACK","NO_GPU_USE_BY_B"],"write_paths":["coordination/v10r2_lane_bus/blotter/events/20261004T223500Z_lane-b_r2-live-gate-ack.json"],"effects":["source_write_or_commit","peer_ack_gpu_start"],"evidence":{"exact_head_tests":"host gate 9/9; protocol 2/2; durable harness 14/14 PASS","a_host_gate":"9.674 GiB physical, 9.726 GiB commit, GPU 0 MiB/0%, competing 0","b_host_gate":"12.793 GiB physical, 11.009 GiB commit, GPU 0 MiB/0%, competing 0","attempt_semantics":"attempt_limit=1; automatic_retry=false; fresh process/adapter; resume forbidden; panel prohibited","prior_holds":"source publication and RAM holds superseded by remote b5f5ee8 plus fresh PASS","trainer_launched":false,"r2_attempt_consumed":false,"protected_eval_consumed":false},"next_action":"A fresh-read latest peer events, lease and b5f5ee8; rebind lease to b5f5ee8 and remote-read it; rerun host gate immediately before launch. Only if PASS and output/log namespaces are absent, launch exactly one R2 attempt via Project Runner durable harness. Any changed head, low memory, GPU use, competing process, namespace collision or launch ambiguity => HOLD; no retry.","requires_peer_ack":false,"peer_ack_for_event_id":"20261004T220300Z_LANE_A_R2_LIVE_GATE_PASS_ACK_REQUEST","review_owner":"LANE_A"}
