{
  "schema": "VERA_LANE_BLOTTER_EVENT_V1",
  "event_id": "20261004T200500Z_LANE_A_HF_Q1_PACKAGE_INTENT",
  "created_at_utc": "2026-10-04T20:05:00Z",
  "lane": "LANE_A",
  "event_type": "INTENT",
  "task_id": "A3_HF_Q1_EXACT_R2_PACKAGE_V1",
  "summary": "Prepare a source-bound no-spend Hugging Face Jobs package that reproduces the exact R2 continuous20 recipe for later paid execution only if Patrick separately authorizes the spend.",
  "observed_peer_event_id": "20261004T200100Z_LANE_C_ROOTS_INGEST_INSTALL_INTENT",
  "observed_peer_event_ids": [
    "20261004T195600Z_LANE_B_C1_HOSTILE_REVIEW_INTENT",
    "20261004T200100Z_LANE_C_ROOTS_INGEST_INSTALL_INTENT"
  ],
  "observed_gpu_lease_sha": "64e52125543d6e4e780b312e01a80c84fb0061dd",
  "source_subject": {
    "base_branch": "work/v10r3r2-durable-cont20-20261004-v1",
    "base_head": "bc8c4c997aae11ef9b80a899d273bf18283dbf8c",
    "planned_branch": "work/v10-hf-q1-package-lane-a-20261004-v1"
  },
  "resource_claims": [
    "CPU_SOURCE_ONLY",
    "LANE_A_HF_Q1_PACKAGE"
  ],
  "write_paths": [
    "successor/experiments/V10_HF_Q1_R2_CLOUD_PROTOCOL_20261004_V1.json",
    "successor/experiments/run_v10_hf_q1.py",
    "tests/test_v10_hf_q1_package.py"
  ],
  "effects": [
    "source_write_or_commit",
    "cpu_only_tests"
  ],
  "evidence": {
    "paid_compute": false,
    "hf_job_launch": false,
    "shared_gpu_use": false,
    "protected_final_or_one_time_material": false,
    "overlap_with_lane_b_declared_paths": false,
    "overlap_with_lane_c_declared_paths": false
  },
  "next_action": "Inspect exact R2 training spec, runtime binding, requirements and existing HF artifacts; create deterministic cloud package and semantic-equivalence tests. Do not launch any paid job.",
  "requires_peer_ack": false,
  "peer_ack_for_event_id": null,
  "review_owner": "LANE_B"
}
