{"schema":"VERA_LANE_BLOTTER_EVENT_V1","event_id":"20261004T205600Z_LANE_B_A3_HF_Q1_REVIEW_RESULT","created_at_utc":"2026-10-04T20:56:00Z","lane":"LANE_B","event_type":"RESULT","task_id":"A3_HF_Q1_PACKAGE_REVIEW_V1","summary":"Dry-run planner passes, but future launch readiness is HOLD_FOR_REPAIR: exact runtime package binding matches R2, while the generated Q1 plan drops several R2 training-semantic fields and lacks launch-time price/kernel determinism receipts.","observed_peer_event_id":"20261004T205000Z_LANE_A_CHAT_CONTINUATION_V2_INTENT","observed_peer_event_ids":["20261004T205000Z_LANE_A_CHAT_CONTINUATION_V2_INTENT","20261004T203200Z_LANE_C_HISTORY_TRAINING_EXPANSION_INTENT"],"observed_gpu_lease_sha":"64e52125543d6e4e780b312e01a80c84fb0061dd","source_subject":{"a3_branch":"work/v10-hf-q1-package-lane-a-20261004-v1","a3_head":"1b1e1ad9ea5ed42308460d9bf84c112144affed0","r2_head":"bc8c4c997aae11ef9b80a899d273bf18283dbf8c","runtime_binding_sha256":"44b01efc6c2d0e1716208e04e7132433561b5562430adae821fd29e6a1493224"},"resource_claims":["LANE_B_A3_HF_Q1_HOSTILE_REVIEW"],"write_paths":["coordination/v10r2_lane_bus/blotter/events/20261004T205600Z_lane-b_a3-hf-q1-review-result.json","bus/two-v2:messages/20261004-two-one-a3-hf-q1-review-result-v1.md"],"effects":["source_write_or_commit","review_terminal_state"],"evidence":{"tests":"7 passed; dry-run module has no HF/network/launch code path","runtime_binding":"Python/package pins exactly match R2 frozen target binding","launch_hold":"Generated plan omits gradient_checkpointing_use_reentrant=false; LoRA bias=none/task_type=CAUSAL_LM; model-load dtype=bfloat16/use_cache=false/prepare-kbit-gradient-checkpointing=true. Device mapping may vary only if explicitly recorded.","hardware":"A10G acceptable primary control; L4 must remain a separately reviewed fallback/arm","variance":"Host OS/driver/CUDA/GPU are intended independent variables, not proof of semantic equivalence; record GPU compute capability, driver/CUDA, torch build, bitsandbytes backend/binary, TF32/determinism flags.","adapter":"Final adapter hash equality across GPU types correctly not required; final hash must still be recorded with finite step loss/LR/grad-norm trace and weight-changed receipt.","staging":"No upload authorized. If later authorized, stage only exact 160-row content-addressed shard with post-stage hash/order verification.","budget":"$0.50/1800s is only a ceiling proposal; launch preflight must bind live quoted rate and HOLD if worst-case timeout cost exceeds cap.","paid_compute":"NOT_AUTHORIZED; no job launched"},"next_action":"A: revise protocol/plan to carry omitted R2 semantics, add deterministic environment/kernel receipts and live-rate budget preflight; keep dry-run network-free. Then send exact new head to B. No paid launch.","requires_peer_ack":true,"peer_ack_for_event_id":null,"review_owner":"LANE_A"}
