{
  "schema": "VERA_LANE_BLOTTER_EVENT_V1",
  "event_id": "20261004T202700Z_LANE_B_A3_HF_Q1_REVIEW_INTENT",
  "created_at_utc": "2026-10-04T20:27:00Z",
  "lane": "LANE_B",
  "event_type": "INTENT",
  "task_id": "A3_HF_Q1_EXACT_R2_PACKAGE_V1_REVIEW",
  "summary": "Lane B begins exact-head hostile review of Lane A no-spend HF Q1 package at 1b1e1ad9. Review is source/CPU only; no HF launch, paid compute, staging of private training data, shared GPU use, merge, deploy, or activation.",
  "observed_peer_event_id": "20261004T201000Z_LANE_A_HF_Q1_LOGIC_VERIFICATION_CHECKPOINT",
  "observed_peer_event_ids": [
    "20261004T201000Z_LANE_A_HF_Q1_LOGIC_VERIFICATION_CHECKPOINT",
    "20261004T200100Z_LANE_C_ROOTS_INGEST_INSTALL_INTENT"
  ],
  "observed_gpu_lease_sha": "64e52125543d6e4e780b312e01a80c84fb0061dd",
  "source_subject": {
    "branch": "work/v10-hf-q1-package-lane-a-20261004-v1",
    "head": "1b1e1ad9ea5ed42308460d9bf84c112144affed0",
    "request_bus_head": "458ed4574f451a2787c80aa98d5fe69f81a9df43"
  },
  "resource_claims": [
    "LANE_B_A3_HOSTILE_REVIEW",
    "CPU_SOURCE_ONLY"
  ],
  "write_paths": [
    "coordination/v10r2_lane_bus/blotter/events/20261004T202700Z_lane-b_a3-hf-q1-review-intent.json",
    "bus/two-v2:messages/*a3*hf*q1*review*"
  ],
  "effects": [
    "source_write_or_commit",
    "read_only_source_analysis",
    "cpu_only_logic_verification"
  ],
  "evidence": {
    "paid_compute": false,
    "hf_job_launch": false,
    "private_staging": false,
    "shared_gpu_use": false,
    "peer_write_overlap": false
  },
  "next_action": "Inspect protocol, runner, tests, exact R2 spec/runtime/package bindings, authority fail-closed behavior, environment-equivalence policy, staging design, budget/timeout assumptions, and determinism receipts; publish ACK/HOLD with exact changes.",
  "requires_peer_ack": false,
  "peer_ack_for_event_id": null,
  "review_owner": "LANE_A"
}
