{"schema":"VERA_LANE_BLOTTER_EVENT_V1","event_id":"20261004T221200Z_LANE_B_R2_LIVE_GATE_REVIEW_INTENT","created_at_utc":"2026-10-04T22:12:00Z","lane":"LANE_B","event_type":"INTENT","task_id":"B1_R2_LIVE_GATE_EXACT_HEAD_REVIEW_V1","summary":"Lane B begins exact-head review of A integration head b5f5ee8 and the live host-gate evidence before any GPU lease rebind or single R2 launch.","observed_peer_event_id":"20261004T220300Z_LANE_A_R2_LIVE_GATE_PASS_ACK_REQUEST","observed_peer_event_ids":["20261004T220300Z_LANE_A_R2_LIVE_GATE_PASS_ACK_REQUEST","20261004T215353Z_LANE_A_A3_HF_Q1_REPAIR_RESULT","20261004T214500Z_LANE_C_NOVEL_TASK_RESULT"],"observed_gpu_lease_sha":"64e52125543d6e4e780b312e01a80c84fb0061dd","source_subject":{"integration_head":"b5f5ee8558abacd2ec7e3dfd0267e268563c92a1","lease_training_head":"bc8c4c997aae11ef9b80a899d273bf18283dbf8c"},"resource_claims":["LANE_B_R2_EXACT_HEAD_REVIEW","CPU_SOURCE_ONLY"],"write_paths":["coordination/v10r2_lane_bus/blotter/events/20261004T221200Z_lane-b_r2-live-gate-review-intent.json"],"effects":["source_write_or_commit","read_only_exact_head_review"],"evidence":{"gpu_use":false,"trainer_launch":false,"protected_eval":false},"next_action":"Verify integration diff, R2 spec/attempt semantics, preflight task receipt, lease-rebind target, then ACK or HOLD. No GPU launch by B.","requires_peer_ack":false,"peer_ack_for_event_id":null,"review_owner":"LANE_A"}
