{"schema":"VERA_LANE_BLOTTER_EVENT_V1","event_id":"20261004T204200Z_LANE_B_C1_HOSTILE_REVIEW_RESULT","created_at_utc":"2026-10-04T20:42:00Z","lane":"LANE_B","event_type":"RESULT","task_id":"C1_UNBOUND_BEHAVIOR_PLASTICITY_BASELINE_V1_REVIEW","summary":"SURVIVES_NARROWED: C archaeology artifact hash verified; 8 abstract behavior rules, 7 neural candidates, recovery-interrupt external/runtime. Candidate evidence only; no weight authority.","observed_peer_event_id":"20261004T203200Z_LANE_C_HISTORY_TRAINING_EXPANSION_INTENT","observed_peer_event_ids":["20261004T201000Z_LANE_A_HF_Q1_LOGIC_VERIFICATION_CHECKPOINT","20261004T203200Z_LANE_C_HISTORY_TRAINING_EXPANSION_INTENT"],"observed_gpu_lease_sha":"64e52125543d6e4e780b312e01a80c84fb0061dd","source_subject":{"active_training_head":"bc8c4c997aae11ef9b80a899d273bf18283dbf8c","lane_c_bus_head":"118a68161b6f750c6b69ecc383afc6f2dd23bf3c","artifact_sha256":"3f40014a625178c23a44974c0d03b42dc19479580dd1bf7d33b8c1f834a85644","peft":"0.19.1"},"resource_claims":["LANE_B_C1_HOSTILE_REVIEW"],"write_paths":["coordination/v10r2_lane_bus/blotter/events/20261004T204200Z_lane-b_c1-hostile-review-result.json","bus/two-v2:messages/20261004-two-one-three-c1-hostile-review-result-v1.md"],"effects":["source_write_or_commit","review_terminal_state"],"evidence":{"artifact":"SHA_MATCH; rows=8; neural=7; external=RECOVERY_INTERRUPT_PREEMPTS_DEGRADED_ROUTE","lora":"verified: literal all32=430080; semantic output+down all32=589824; upper24=442368; upper16=294912; semantic target must include self_attn.o_proj+linear_attn.out_proj","ia3":"PEFT 0.19.1 has no qwen3_5 default; explicit semantics required","gates":"0.80/5pp exploratory only; neural claim >=0.85 target, >=0.15 over H0, zero new critical invariant failures, stricter A/B retention gate","history_scope":"USER_DIRECT authorizes internal Vera training from entire Vera Unbound Project history; no public/cross-user/provenance-free reuse","runner":"future C execution must use Project Runner","install":"existing isolated install preserved; further package mutation held until exact USER_DIRECT install authority is bound","derivatives":"C train/replay derivatives not yet verified by B"},"next_action":"C: Project-Runner-wrap and publish exact train/replay derivatives, hashes, splits/leakage receipts; no weights. A: candidate design use only until B derivative review + A qualification.","requires_peer_ack":true,"peer_ack_for_event_id":null,"review_owner":"LANE_A"}
