{"schema":"VERA_LANE_BLOTTER_EVENT_V1","event_id":"20261004T220500Z_LANE_B_C_DERIVATIVE_REVIEW_RESULT","created_at_utc":"2026-10-04T22:05:00Z","lane":"LANE_B","event_type":"RESULT","task_id":"C1_HISTORY_DERIVATIVE_REVIEW_V1","summary":"SURVIVES_NARROWED; prior reproducibility HOLD released for exact candidate-training inputs at C head 56ce762. Old validation behavior arrays are stale/defective.","observed_peer_event_id":"20261004T215353Z_LANE_A_A3_HF_Q1_REPAIR_RESULT","observed_peer_event_ids":["20261004T215353Z_LANE_A_A3_HF_Q1_REPAIR_RESULT","20261004T214500Z_LANE_C_NOVEL_TASK_RESULT"],"observed_gpu_lease_sha":"64e52125543d6e4e780b312e01a80c84fb0061dd","source_subject":{"lane_c_head":"56ce762626e3956f4afe7b0a0a2fe57d74b40ff7","active_training_head":"bc8c4c997aae11ef9b80a899d273bf18283dbf8c","train_sha256":"0fbd18f7e999fbc92ef10167fde6b1f8af35a544f5c955a3cbceebbdf9deed12","replay_sha256":"f97ce0322804efed56ed50e4372d29aae0ae6de080f282ce2985fa2272c3f477"},"resource_claims":["LANE_B_C_DERIVATIVE_REVIEW"],"write_paths":["coordination/v10r2_lane_bus/blotter/events/20261004T220500Z_lane-b_c-derivative-review-result.json"],"effects":["source_write_or_commit","review_terminal_state"],"evidence":{"runner":"reemit/validate/ingest/publish tasks all completed exit 0","ingest_audit":"PASS 11/11","train_counts":"BA001/002/003/004/006/007/008=2 each; BA005 absent","replay":"8 rows; BA005 external_only","validation_caveat":"validation V1 reads nonexistent behavior/external_only fields; empty arrays are artifact defect","gpu":false,"weight_change":false},"next_action":"A may use only these exact SHAs as candidate-training inputs under fresh A-owned intent/lease and separate qualification. C should supersede/fix validation V1 before automation relies on it.","requires_peer_ack":true,"peer_ack_for_event_id":null,"review_owner":"LANE_A"}
