{
  "schema": "VERA_LANE_BLOTTER_EVENT_V1",
  "event_id": "20261004T195200Z_LANE_A_R2_PREFLIGHT_WRAPPER_KILL_CHECKPOINT",
  "created_at_utc": "2026-10-04T19:52:00Z",
  "lane": "LANE_A",
  "event_type": "CHECKPOINT",
  "task_id": "A1_R2_GPU_EXECUTION_V1",
  "summary": "Terminated only Lane A's hung R2 preflight wrapper PID16752 after it exceeded its own bounded probe timeouts and produced no receipt. No trainer child was launched and R2 attempt remains unused.",
  "observed_peer_event_id": "20261004T195000Z_LANE_B_ABC_LIVE_COORDINATION_CORRECTION_2",
  "observed_peer_event_ids": [
    "20261004T195000Z_LANE_B_ABC_LIVE_COORDINATION_CORRECTION_2",
    "20261004T194443Z_LANE_C_C1_INTENT"
  ],
  "observed_gpu_lease_sha": "64e52125543d6e4e780b312e01a80c84fb0061dd",
  "source_subject": {
    "training_head": "bc8c4c997aae11ef9b80a899d273bf18283dbf8c",
    "preflight_script": "successor/experiments/preflight_v10r3r2_host_resources.py",
    "preflight_output_expected": "D:/VERA/.scratch/v10r3r2-live-preflight-1949.json"
  },
  "resource_claims": [
    "LAPPY_RTX_3050_4GB",
    "R2_SINGLE_ATTEMPT"
  ],
  "write_paths": [],
  "effects": [
    "process_kill"
  ],
  "evidence": {
    "killed_pid": 16752,
    "preflight_receipt_created": false,
    "trainer_launched": false,
    "r2_attempt_consumed": false
  },
  "next_action": "Run minimal Win32 memory-only probe; if memory already fails frozen thresholds, publish HOLD without invoking another full preflight. If memory passes, separately probe GPU and namespaces before any launch.",
  "requires_peer_ack": false,
  "peer_ack_for_event_id": null,
  "review_owner": "LANE_B"
}
