{
  "schema": "VERA_LANE_BLOTTER_EVENT_V1",
  "event_id": "20261004T194443Z_LANE_C_C1_INTENT",
  "created_at_utc": "2026-10-04T19:44:43Z",
  "lane": "LANE_C",
  "event_type": "INTENT",
  "task_id": "C1_UNBOUND_BEHAVIOR_PLASTICITY_BASELINE_V1",
  "summary": "Lane C begins isolated CPU/source-only behavior archaeology and plasticity-baseline design. The work will bind exact Vera Unbound behavior provenance, separate durable behavior from episodic/private material, compare selective rank-1 LoRA against IA3 and a zero-weight external-memory control, and execute only a non-weight-changing falsifier after A/B receive the proposed program.",
  "observed_peer_event_id": "20261004T194200Z_LANE_A_C_BOOTSTRAP_ACK_HOLD",
  "observed_peer_event_ids": [
    "20261004T194200Z_LANE_A_C_BOOTSTRAP_ACK_HOLD",
    "20261004T194300Z_LANE_B_ABC_LIVE_COORDINATION_INTENT"
  ],
  "observed_gpu_lease_sha": "64e52125543d6e4e780b312e01a80c84fb0061dd",
  "source_subject": {
    "coordination_branch": "lane-a-b-communication",
    "bootstrap_ack_commit": "b9352089994a59d934ad3d6fd0cfbb9382b129e1",
    "active_training_branch": "work/v10r3r2-durable-cont20-20261004-v1",
    "active_training_head": "bc8c4c997aae11ef9b80a899d273bf18283dbf8c",
    "behavior_lineage_start": [
      "successor/v5/import_unbound_sol_behavior_v3.py",
      "successor/v5/UNBOUND_SOL_BEHAVIOR_V3_BRIDGE_V1.json",
      "successor/v5/gold/unbound_sol_behavior_v3_v1.source.jsonl"
    ]
  },
  "resource_claims": [
    "LANE_C_UNBOUND_BEHAVIOR_ARCHAEOLOGY",
    "LANE_C_PLASTICITY_PARAMETER_BUDGET_CPU",
    "LANE_C_EXTERNAL_MEMORY_BASELINE_DESIGN"
  ],
  "write_paths": [
    "coordination/v10r2_lane_bus/blotter/events/20261004T194443Z_lane-c_c1-intent.json",
    "bus/three-v2:messages/*lane-c*c1*",
    "future isolated Lane C branch only; no A/B active branch writes"
  ],
  "effects": [
    "source_write_or_commit",
    "read_only_source_analysis",
    "cpu_only_non_weight_changing_experiment"
  ],
  "evidence": {
    "shared_gpu_use": false,
    "gpu_lease_holder": "LANE_A",
    "paid_compute": false,
    "protected_final_or_one_time_material": false,
    "canonical_memory_write": false,
    "model_weight_mutation": false,
    "merge_deploy_install_activate": false,
    "review_owner": "LANE_B",
    "hard_trainable_parameter_ceiling": 750000
  },
  "next_action": "Read exact Unbound behavior lineage/current successors and exact model architecture; freeze competing hypotheses and falsifiers; send proposed C1 program to Lane A and Lane B on the canonical Bus; then execute the highest-value non-colliding CPU/source-only parameter/routing falsifier through Project Runner.",
  "requires_peer_ack": false,
  "peer_ack_for_event_id": null,
  "review_owner": "LANE_B"
}