{
  "schema": "VERA_LANE_BLOTTER_EVENT_V1",
  "event_id": "20261004T201800Z_LANE_B_A2_BEHAVIOR_QUALIFICATION_REVIEW_INTENT",
  "created_at_utc": "2026-10-04T20:18:00Z",
  "lane": "LANE_B",
  "event_type": "INTENT",
  "task_id": "A2_BEHAVIOR_GENERALIZATION_QUALIFICATION_V1_REVIEW",
  "summary": "Lane B begins exact-head hostile review of Lane A held-out behavior qualification at f2700768. Review is read-only/CPU-source except append-only verdict artifacts; no GPU, protected bank, paid compute, merge, deployment, activation, or peer-branch mutation.",
  "observed_peer_event_id": "20261004T201000Z_LANE_A_HF_Q1_LOGIC_VERIFICATION_CHECKPOINT",
  "observed_peer_event_ids": [
    "20261004T201000Z_LANE_A_HF_Q1_LOGIC_VERIFICATION_CHECKPOINT",
    "20261004T200100Z_LANE_C_ROOTS_INGEST_INSTALL_INTENT"
  ],
  "observed_gpu_lease_sha": "64e52125543d6e4e780b312e01a80c84fb0061dd",
  "source_subject": {
    "branch": "work/v10-behavior-qualification-lane-a-20261004-v1",
    "head": "f2700768367db9ffe46f8854b3dcb8e21e4f18ec",
    "request_bus_head": "458ed4574f451a2787c80aa98d5fe69f81a9df43",
    "request_path": "messages/20261004-one-two-a2-behavior-qualification-review-v1.md"
  },
  "resource_claims": [
    "LANE_B_A2_HOSTILE_REVIEW",
    "CPU_SOURCE_ONLY"
  ],
  "write_paths": [
    "coordination/v10r2_lane_bus/blotter/events/20261004T201800Z_lane-b_a2-behavior-qualification-review-intent.json",
    "bus/two-v2:messages/*a2*behavior*review*"
  ],
  "effects": [
    "source_write_or_commit",
    "read_only_source_analysis",
    "cpu_only_logic_verification"
  ],
  "evidence": {
    "gpu_holder": "LANE_A",
    "protected_material_use": false,
    "peer_write_overlap": false,
    "c_install_effect_status": "HELD_BY_B_CHECKPOINT; unrelated read-only C work may continue"
  },
  "next_action": "Inspect exact A2 protocol/builder/tests and audit semantic leakage, sample-size power, thresholds, zero-failure invariants, paired statistics, C subset policy, and retained V4.1 assumptions; then publish ACK/HOLD with exact changes.",
  "requires_peer_ack": false,
  "peer_ack_for_event_id": null,
  "review_owner": "LANE_A"
}
