{
  "schema": "VERA_LANE_BLOTTER_EVENT_V1",
  "event_id": "20261004T210600Z_LANE_B_CHAT_CONTINUATION_V12_RESULT",
  "created_at_utc": "2026-10-04T21:06:00Z",
  "lane": "LANE_B",
  "event_type": "RESULT",
  "task_id": "LANE_B_CHAT_CONTINUATION_20261004_V12",
  "summary": "Lane B froze a superseding V12 continuation with current R2 runtime-memory HOLD, A2/A3 terminal reviews, role-neutral identity semantics, C1 narrowed result, and exact new-chat restore command.",
  "observed_peer_event_id": "20261004T205300Z_LANE_A_CHAT_CONTINUATION_V2_RESULT",
  "observed_peer_event_ids": [
    "20261004T205300Z_LANE_A_CHAT_CONTINUATION_V2_RESULT",
    "20261004T203200Z_LANE_C_HISTORY_TRAINING_EXPANSION_INTENT"
  ],
  "observed_gpu_lease_sha": "64e52125543d6e4e780b312e01a80c84fb0061dd",
  "source_subject": {
    "continuation_branch": "work/v10r3-eval-gates-lane-b-20261004-v1",
    "continuation_head": "adcfde606bfe806e6c7dd6170be6e22bdd4643db",
    "continuation_markdown": "state/continuation/V10_MODEL_TRAINING_LANE_B_CONTINUATION_20261004_V12.md",
    "current_pointer": "state/continuation/V10_MODEL_TRAINING_LANE_B_CURRENT.md",
    "latest_reviewed_a2_head": "f2700768367db9ffe46f8854b3dcb8e21e4f18ec",
    "latest_reviewed_a3_head": "1b1e1ad9ea5ed42308460d9bf84c112144affed0",
    "active_r2_head": "bc8c4c997aae11ef9b80a899d273bf18283dbf8c"
  },
  "resource_claims": [
    "LANE_B_STATE_HANDOFF",
    "CPU_SOURCE_ONLY"
  ],
  "write_paths": [
    "state/continuation/V10_MODEL_TRAINING_LANE_B_CONTINUATION_20261004_V12.md",
    "state/continuation/V10_MODEL_TRAINING_LANE_B_CURRENT.md",
    "coordination/v10r2_lane_bus/status/lane-b.json",
    "coordination/v10r2_lane_bus/blotter/events/20261004T210600Z_lane-b_chat-continuation-v12-result.json"
  ],
  "effects": [
    "source_write_or_commit",
    "continuation_checkpoint"
  ],
  "evidence": {
    "remote_readback": "PASS_CURRENT_EQUALS_V12",
    "r2_trainer_launched": false,
    "r2_attempt_consumed": false,
    "live_gpu_memory_used_mib": 0,
    "live_physical_available_gib": 4.968,
    "a2_review": "HOLD_AWAITING_REVISION",
    "a3_hf_review": "HOLD_FOR_REPAIR_NO_PAID_COMPUTE",
    "lane_a_unreviewed_proposal_visible": false,
    "continuation_command": "VERA_MODEL_TRAINING::LANE_B::RESUME_FROM_REPO::thebrazenbeard/vera_model_training::work/v10r3-eval-gates-lane-b-20261004-v1::state/continuation/V10_MODEL_TRAINING_LANE_B_CURRENT.md"
  },
  "next_action": "New Lane B chat runs continuation command, fresh-reads blotter/heads/lease/process state, then reviews any newer Lane A exact head or monitors R2 if it launches. Keep panel sealed and no paid HF launch without Patrick explicit spend approval.",
  "requires_peer_ack": false,
  "peer_ack_for_event_id": null,
  "review_owner": "LANE_B"
}
